date,headline,source,compound,sentiment
2022-12-17,"Sovereign Gold Bond issue price fixed at Rs 5,409/gram of gold, subscription opens Monday; All you need to know - Mint",Mint,0.0,Neutral
2022-12-17,Cyclical stocks - Stock Market Investment: 5 types of stocks you should know about - The Economic Times,The Economic Times,0.0,Neutral
2022-12-19,HDFC Bank targets issuing one million credit cards a month - The Financial Express,The Financial Express,0.3818,Positive
2022-12-19,HDFC Bank in talks for loan of up to $1 billion - Moneycontrol.com,Moneycontrol.com,0.0,Neutral
2022-12-19,HDFC Bank eyes $1bn capital raise via offshore loans - Retail Banker International,Retail Banker International,0.0,Neutral
2022-12-21,"Bajaj Finance shares trail Sensex, Nifty for the first time in 14 years - Moneycontrol.com",Moneycontrol.com,0.5994,Positive
2022-12-21,Axis Bank Shares at Fresh Life-Time High; Should you Book Profit or Accumulate? - News18,News18,0.7506,Positive
2022-12-22,"FD premature withdrawal charges of SBI, HDFC Bank, ICICI Bank, PNB - The Economic Times",The Economic Times,-0.25,Negative
2022-12-24,Buy HDFC Bank Ltd For Target Rs.1867 - GEPL Capital - Investment Guru,Investment Guru,0.0,Neutral
2022-12-24,Bajaj Finance set for its lowest annual share price returns in a decade - What lies ahead? - CNBC TV18,CNBC TV18,-0.4939,Negative
2022-12-25,Metal stock fixes record date for ₹150 Cr share buyback at a premium of 13% - Mint,Mint,0.296,Positive
2022-12-27,"HDFC Bank hikes bulk FD rates, senior citizens can earn as high as 7.75% - Mint",Mint,0.0,Neutral
2022-12-30,"Sensex, Nifty end 2022 with over 4% gains: How markets outperformed global peers - The Times of India",The Times of India,0.6249,Positive
2022-12-30,"HDFC, Adani Enterprises and other memed stocks of the year - Moneycontrol.com",Moneycontrol.com,0.0,Neutral
2023-01-02,"RBI says SBI, ICICI Bank, HDFC Bank remain domestic systemically important banks - Business Today",Business Today,0.2023,Positive
2023-01-02,WhatsApp leak case: Sebi dismisses insider trading charges against 11 entities - The Economic Times,The Economic Times,-0.5423,Negative
2023-01-02,"SBI, ICICI Bank, HDFC Bank continue to remain systemically important banks: RBI - The Times of India",The Times of India,0.2023,Positive
2023-01-02,Nifty to reclaim 18250 or profit booking to continue? 7 things to know before share market opens - The Financial Express,The Financial Express,0.7783,Positive
2023-01-02,"Stock market holidays: NSE, BSE to remain closed on these days in 2023 - Mint",Mint,0.3818,Positive
2023-01-03,"SBI board approves raising ₹10,000 crore via infrastructure bonds - Mint",Mint,0.4019,Positive
2023-01-03,"HDFC Bank hikes bulk FD rates, new interest rates are effective from today - Mint",Mint,0.7269,Positive
2023-01-03,HDFC Bank partners with Microsoft for digital transformation journey - Mint,Mint,0.0,Neutral
2023-01-04,HDFC Bank Posts 19.5% Loan Growth in December 2022 Quarter - News18,News18,0.3818,Positive
2023-01-04,HDFC Bank posts 19.5% loan growth in Q3 - YourStory.com,YourStory.com,0.3818,Positive
2023-01-04,Steep discount in domestic spot gold to bank rate raises eyebrows - Mint,Mint,0.0,Neutral
2023-01-08,"This HDFC fund turns 28 years, SIP of ₹10,000 turns ₹12 Cr at a CAGR of 21% - Mint",Mint,0.0,Neutral
2023-01-09,Post Office Term Deposits vs bank FDs: Which is offering higher interest rate - The Economic Times,The Economic Times,0.4588,Positive
2023-01-09,Top 5 Private Banks By Growth - Equitymaster,Equitymaster,0.5267,Positive
2023-01-12,"Banking sector Q3 preview: Another strong quarter, says Sharekhan - Mint",Mint,0.5106,Positive
2023-01-12,HCL Tech Q3 earnings preview: Here's what to watch out for - Mint,Mint,0.0,Neutral
2023-01-13,Large deal wins lift Wipro IT services revenue in Oct-Dec - Mint,Mint,0.5719,Positive
2023-01-13,HDFC Bank Q3FY23 Results Preview: How Much Interest Income Is Possible In December Quarter? - Zee Business,Zee Business,0.4588,Positive
2023-01-14,"Q3 results, US data among key factors that may influence Dalal Street next week - Business Today",Business Today,0.0,Neutral
2023-01-14,"HDFC Bank Q3 results 2023: Net profit jumps 18.5%, NII up 24.6% - Mint",Mint,0.4404,Positive
2023-01-16,Analysts expect HDFC Bank shares to grow one-fourth in value after strong Q3 show - Zee Business,Zee Business,0.7845,Positive
2023-01-16,HDFC Bank Q3 Result: Most brokerages maintain estimates after strongest NII growth in 14 quarters - CNBC TV18,CNBC TV18,0.6705,Positive
2023-01-16,How did HDFC Bank manage the highest ever deposit growth in Q3? Here’s what experts say - Moneycontrol.com,Moneycontrol.com,0.3818,Positive
2023-01-17,From ₹83 to ₹143: What to do with Federal Bank shares post Q3 results? - Fortune India,Fortune India,0.296,Positive
2023-01-17,"Q3 preview: IndusInd Bank net profit may jump nearly 60% to Rs 1,850 cr on robust loan growth, improving NII - Zee Business",Zee Business,0.8658,Positive
2023-01-17,Stock Market Today: All You Need To Know Going Into Trade On Jan. 17 - NDTV Profit,NDTV Profit,0.4404,Positive
2023-01-18,"HDFC Twins Continued Their Gains, Rising More Than 3% in Two Trading Days - Equitypandit",Equitypandit,0.34,Positive
2023-01-19,"Stocks in news: Bharti Airtel, Asian Paints, HUL, IndusInd Bank and more - Business Today",Business Today,0.0,Neutral
2023-01-19,"HDFC Bank stock was Rs 300 in 2013. Now, it's priced over Rs 1,600 - Business Today",Business Today,0.0,Neutral
2023-01-20,"HDFC Bank Outlook for the Week (Jan 23, 2023 – Jan 27, 2023) - Equitypandit",Equitypandit,0.0,Neutral
2023-01-20,"RIL, JSW Steel, LTIMindtree, Tanla Platforms, Atul Q3 results today; Heritage Foods to turn ex-rights - Business Today",Business Today,0.0,Neutral
2023-01-23,Latest NRE FD interest rates: SBI Vs HDFC Bank Vs ICICI Bank Vs Federal Bank vs PNB - The Economic Times,The Economic Times,0.4588,Positive
2023-01-23,Boring Companies Compound Profits At 20% p.a. - marcellus.in,marcellus.in,0.1531,Positive
2023-01-24,"HDFC Bank hikes FD rates, senior citizens get up to 7.75% effective from today - Mint",Mint,0.4767,Positive
2023-01-24,Axis Bank shares fall 3% despite strong Q3; here’s why - Fortune India,Fortune India,-0.1285,Negative
2023-01-25,SBI customers: How to get SBI bank account statements via call - The Economic Times,The Economic Times,0.0,Neutral
2023-01-27,HDFC Bank: CEO Sashidhar Jagdishan has a golden opportunity to seize market share; Can he do it? - Business Today,Business Today,0.6124,Positive
2023-01-28,"HDFC Bank hikes bulk FD rates, senior citizens earn up to 7.75% on this tenor - Mint",Mint,0.0,Neutral
2023-01-29,ETMarkets Trade Talk: How this Lucknow MBA trader shifts seamlessly between futures & options - The Economic Times,The Economic Times,0.0,Neutral
2023-01-30,PNB Q3 Results: Net profit falls 44% YoY to Rs 629 crore - The Economic Times,The Economic Times,0.4404,Positive
2023-01-30,"Bandhan Bank hikes bulk FD rates, now get up to 7.90% effective from today - Mint",Mint,0.4767,Positive
2023-01-30,Your Money: Asset allocation quilt: Figuring out the winners - The Financial Express,The Financial Express,0.6808,Positive
2023-01-30,‘Banks to which the Adani group had no exposure failed as well’ - The Times of India,The Times of India,0.1285,Positive
2023-01-31,MakeMyTrip turns profitable as travel demand improves - Mint,Mint,0.6369,Positive
2023-02-01,Rakesh Jhunjhunwala & Associates Increase Stake in This Private Bank Stock. Do You Own? - Equitymaster,Equitymaster,0.3182,Positive
2023-02-01,"Markets Wrap – Wed, 1 Feb ‘23: Stocks end mixed, rupee gains; Global markets, Gold, Crude, Crypto updates - The Financial Express",The Financial Express,-0.3182,Negative
2023-02-01,"Union Budget 2023 | Sensex jumps 640 points; Nifty nears 17,800 level - The Hindu",The Hindu,0.4019,Positive
2023-02-01,Essential PayZapp Statistics to Understand Its Popularity In The Mobile Payment Market - Enterprise Apps Today,Enterprise Apps Today,0.4767,Positive
2023-02-02,"HDFC Q3 Results: Profit rises 13% YoY to Rs 3,691 cr; NII up 30% - The Economic Times",The Economic Times,0.4404,Positive
2023-02-03,Patanjali Foods tanked 25% after Q3 earnings. What is weighing on the stock? - Business Today,Business Today,0.0,Neutral
2023-02-03,NSE includes brokerage firm on watch list - Mint,Mint,0.0,Neutral
2023-02-07,HDFC-HDFC Bank merger creates world’s 4th largest bank with m-cap of $180 bn - Qatar Tribune,Qatar Tribune,0.2732,Positive
2023-02-07,SURU Effect: Why HDFC Bank's Branch Strategy Might Be The Smartest - NDTV Profit,NDTV Profit,0.7845,Positive
2023-02-09,Fire breaks out at HDFC Bank in Delhi's Greater Kailash - CNBC TV18,CNBC TV18,0.0258,Neutral
2023-02-10,"RBI repo rate hike: HDFC, Punjab National Bank, Bank of Baroda raise lending rates, home, car loan EMIs - Business Today",Business Today,0.0,Neutral
2023-02-10,Nifty to climb above 18000 or correction on cards? 7 things to know before share market opens - The Financial Express,The Financial Express,0.5994,Positive
2023-02-11,Tracing the Roots: A Look into the History of HDFC Bank - India CSR,India CSR,0.0,Neutral
2023-02-14,Patel Engineering to raise Rs 324.91 cr via rights issue - Business Standard,Business Standard,0.0,Neutral
2023-02-14,"Navratna company NMDC declares dividend, net profit falls 55% in Q3 - Mint",Mint,0.4404,Positive
2023-02-14,HDFC Bank to sell entire 9.95% stake in Softcell Technologies - BusinessLine,BusinessLine,0.0,Neutral
2023-02-16,HDFC Bank goes live on 'Rupay Credit on UPI' feature for customers - Business Standard,Business Standard,0.3818,Positive
2023-02-16,DCB Bank hikes FD rates up to 8.50% for senior citizens effective from today - Mint,Mint,0.4767,Positive
2023-02-18,"HDFC Bank hikes bulk FD rates, earn up to 7.15% for 15 months to 2 years tenor - Mint",Mint,0.0,Neutral
2023-02-20,Bandhan Bank rewards employees with stock options. 5 key details you should know - Mint,Mint,0.4767,Positive
2023-02-21,Five interesting stocks from TIA’s 20-20 Ideas Summit | Mint - Mint,Mint,0.4019,Positive
2023-02-21,"CESC declares 450% dividend, share trading at a dividend yield of 5.81% - Mint",Mint,0.296,Positive
2023-02-21,2 real estate stocks to buy as brokerage shares top picks in the sector - Mint,Mint,0.4588,Positive
2023-02-21,Mumbai-based Cliqtrade Stock Brokers buys 10% more stake in Asit C Mehta - Mint,Mint,0.0,Neutral
2023-02-21,"Stock Market Opening: Share market sees rise, NTPC among top gainers, Adani Enterprises in loss - news24online.com",news24online.com,0.1779,Positive
2023-02-22,"iPhone 13 selling with up to Rs 41,000 discount, iPhone 14 available at Rs 45,000, iPhone 12 at Rs 28,999: Details - The Financial Express",The Financial Express,0.0,Neutral
2023-02-22,"HDFC Bank, Lulu Exchange ink deal to enhance cross-border payments between India-Gulf region - Trade Brains",Trade Brains,0.0,Neutral
2023-02-22,"Senior Citizen Savings Scheme vs bank FDs for senior citizens: Updated interest rates, tax benefits - Business Today",Business Today,0.6808,Positive
2023-02-23,67% Indians rely on personal loans for funding needs. Here are some do's and don’ts - Mint,Mint,0.0,Neutral
2023-02-23,ICICI Bank hikes bulk FD rates up to 7.15% effective from today - Mint,Mint,0.4767,Positive
2023-02-23,NSE receives final approval to launch Social Stock Exchange as separate segment - Mint,Mint,0.4767,Positive
2023-02-24,"Stocks to watch: HDFC Bank, Infosys, Zee Entertainment, Axis Bank and others - Business Upturn",Business Upturn,0.4215,Positive
2023-02-24,"'Dear SBI user, Your YONO account will be blocked': Know all about SBI fake message scam - The Economic Times",The Economic Times,-0.743,Negative
2023-02-24,"Senior citizen FD: Earn up to 8%; check SBI, HDFC Bank, ICICI Bank, and IDBI Bank special fixed deposit rates - The Economic Times",The Economic Times,0.4019,Positive
2023-02-24,HDFC Bank raises $750 mn in dollar bond sale - Mint,Mint,0.0,Neutral
2023-02-24,Paytm introduces UPI Lite for payments of up to Rs 200 without PIN; details here - Business Today,Business Today,0.0,Neutral
2023-02-25,Multibagger Manish Goel stock turns ₹1 lakh into ₹1.57 crore in 14 years - Mint,Mint,0.0,Neutral
2023-02-27,Banks to compensate for loss - New bank locker agreement rules: All you need to know - The Economic Times,The Economic Times,0.2263,Positive
2023-02-28,"MRF raises ₹150 crore, NCDs listed on NSE debt segment - Mint",Mint,-0.3612,Negative
2023-02-28,Goldman considers shrinking its consumer business - Mint,Mint,0.0,Neutral
2023-02-28,NCLT reserves order in HDFC-HDFC Bank merger - ET Now,ET Now,0.0,Neutral
2023-02-28,RBI likely to raise repo rate by another 25bps to tame inflation - The Times of India,The Times of India,0.0,Neutral
2023-03-01,HDFC Bank's Sashidhar Jagdishan is 'BS Banker of the Year 2022' - Business Standard,Business Standard,0.0,Neutral
2023-03-01,"HDFC Bank, IRCTC launch India's most rewarding co-branded travel credit card - Mint",Mint,0.7425,Positive
2023-03-01,IRCTC HDFC Bank Credit Card: Get railway lounge access and reward points on train ticket booking - The Financial Express,The Financial Express,0.743,Positive
2023-03-02,HDFC vs Suryoday vs Equitas Small Finance Bank: Fixed Deposits revised from March 1; check out FD details - Business Today,Business Today,0.0,Neutral
2023-03-02,"Up to 50% upside: IDBI Capital Market bullish on these banks, NBFC and housing finance majors - Business Today",Business Today,0.0,Neutral
2023-03-03,Adani family sells stake in 4 cos to US firm for Rs 15.4k cr - The Times of India,The Times of India,0.0,Neutral
2023-03-03,"YES Bank 3-year lock-in period ends soon: Returns that SBI, others made on their investments - Business Today",Business Today,0.5319,Positive
2023-03-03,"HDFC customers: 'KYC update is due for HDFC account', know about latest scam and how to protect yourself - The Economic Times",The Economic Times,-0.2732,Negative
2023-03-04,"Bandhan Bank hikes savings account interest rates, now earn up to 6.50% - Mint",Mint,0.4588,Positive
2023-03-04,"Applying for a car loan? From processing fee to down payment, make note of these key points - Mint",Mint,0.0,Neutral
2023-03-04,"HDFC Bank proposes re-appointment of Sashidhar Jagdishan as MD, CEO for 3 years - Business Today",Business Today,0.0,Neutral
2023-03-04,"HDFC Bank recommends re-appointment of Sashidhar Jagdishan MD, CEO for 3 yrs - Mint",Mint,0.2263,Positive
2023-03-06,"Share Market HIGHLIGHTS: Sensex ends 415 pts higher, Nifty50 reclaims 17,700 led by IT, financial shares; Infosys, TCS among top movers - Zee Business",Zee Business,0.6369,Positive
2023-03-06,JSA advised HDFC Bank Limited in the issue of $750 million 5.686% Senior Notes due 2026 - Bar and Bench,Bar and Bench,-0.2263,Negative
2023-03-06,YES Bank shares down 3% as 3-year lock-in period expires today - Fortune India,Fortune India,0.6841,Positive
2023-03-06,Order on gratuity in HDFC Bank case may hit corporates - Mint,Mint,0.0,Neutral
2023-03-07,"'Account will be suspended, Update PAN': HDFC Bank customers, stay alert against such messages - Mint",Mint,-0.2263,Negative
2023-03-07,HDFC Bank's NBFC arm confirms data leak of customers - Mint,Mint,-0.34,Negative
2023-03-09,HDFC Bank hikes bulk FD rates up to 7.75% effective from today - Mint,Mint,0.4767,Positive
2023-03-09,HDFC Bank’s NBFC Arm HDB Financial Services Confirms Customer Loan Data Breach - Outlook Money,Outlook Money,0.0,Neutral
2023-03-12,Yes Bank stocks may face mass selling as 3-yr RBI-mandated lock-in ends on Monday - The Economic Times,The Economic Times,0.4019,Positive
2023-03-13,"Lock-in in Yes bank ends, what should retail investors do? - Mint",Mint,0.4019,Positive
2023-03-13,Yes Bank shares end over 5 pc after 3 yr lock-in period expires - The Times of India,The Times of India,0.5994,Positive
2023-03-13,GAIL announces interim dividend of Rs4 per share - Mint,Mint,0.296,Positive
2023-03-13,Why Yes Bank Shares Plunged Over 12% Today - India.Com,India.Com,0.5994,Positive
2023-03-13,Yes Bank 3-year lock-in period ends today: 10 things to know - Mint,Mint,0.4019,Positive
2023-03-14,"Higher than SBI, HDFC Bank, ICICI Bank: These small finance banks offer up to 9% on FDs - Business Today",Business Today,0.0,Neutral
2023-03-14,"Sensex ends below 58k, Nifty holds 17,000; PNB Housing tanks 9%, AEL drops 7% - Business Today",Business Today,0.4019,Positive
2023-03-16,EPFO gift for employees: Rates of welfare activities and awards increased! Details here - The Financial Express,The Financial Express,0.807,Positive
2023-03-16,ET Money Show: Tips to improve your credit score - The Economic Times,The Economic Times,0.6705,Positive
2023-03-16,LIC to SBI: How much pension can you get for Rs 1 crore? Annuity rates of 12 ASPs compared - The Financial Express,The Financial Express,0.0,Neutral
2023-03-16,HDFC Bank partners with Manipal Global Skills Academy to launch LXP - An All-Women Job-Ready Training Program - Business Standard,Business Standard,0.0,Neutral
2023-03-16,How HDFC Bank customers can identify fake SMS messages - The Economic Times,The Economic Times,-0.4767,Negative
2023-03-17,"Multibagger stock sets record date for 24:100 bonus share, up 750% in 1 year - Mint",Mint,0.6908,Positive
2023-03-17,HDFC-HDFC Bank merger approved by NCLT - The Economic Times,The Economic Times,0.4215,Positive
2023-03-18,NCLT approves merger of HDFC with HDFC Bank - The New Indian Express,The New Indian Express,0.4019,Positive
2023-03-19,5 reasons why people are buying property in spiritual places like Mathura and Vrindavan - The Financial Express,The Financial Express,0.3612,Positive
2023-03-21,"Share Market HIGHLIGHTS: Nifty 50 reclaims 17,100, Sensex back above 58,000; HDFC Bank, ICICI Bank aid 500-point surge in banking index - Zee Business",Zee Business,0.5994,Positive
2023-03-21,"Deep Industries sets record date for 1:2 stock split, scrip up over 650% in 3 years - Mint",Mint,0.0,Neutral
2023-03-21,SBI MF buys over 2% stake in HDFC AMC; stock jumps 5% - Fortune India,Fortune India,0.0,Neutral
2023-03-21,"SBI, PNB, HDFC, ICICI Senior Citizen FD rates vs Kisan Vikas Patra: Which schemes pay better interest rates? - Business Today",Business Today,0.6705,Positive
2023-03-21,"HDFC Bank rises Tuesday, outperforms market - MarketWatch",MarketWatch,0.0,Neutral
2023-03-22,India's Worst Performing Banking Stocks of 2023 So Far - Equitymaster,Equitymaster,-0.6249,Negative
2023-03-22,"This broking firm declares 4th interim dividend, FIIs stake up 5.98% in Q3: Buy sell or add? - Mint",Mint,0.0,Neutral
2023-03-22,Want to buy your dream car or dream house this year? How to plan SMARTly - The Economic Times,The Economic Times,0.7003,Positive
2023-03-23,"How Fed rate hike will impact Indian stock market, explained - The Economic Times",The Economic Times,0.0,Neutral
2023-03-24,How to login and view AIS (Annual Information Statement) on mobile app - The Economic Times,The Economic Times,0.0,Neutral
2023-03-24,"Adani group stocks: Nine are down in FY23, expect once; mcap tanks to ₹8.63 lakh cr - Mint",Mint,0.0,Neutral
2023-03-26,Your Questions Answered: What happens to my money if a bank goes bankrupt? - Mint,Mint,-0.5574,Negative
2023-03-27,"PAN-Aadhaar Linking 2023 FAQs: Last date, fees and impact of not linking PAN and Aadhaar – Explained - The Financial Express",The Financial Express,0.0,Neutral
2023-03-28,"HDFC gets board’s nod for raising Rs 57,000 crore via NCDs in tranches - The New Indian Express",The New Indian Express,0.0,Neutral
2023-03-28,"HDFC approved issuance of NCDs worth Rs 57,000 cr ahead of its merger with HDFC Bank - Elets BFSI",Elets BFSI,0.5719,Positive
2023-03-29,"IndusInd Bank shares: Despite high promoter pledge, here are four triggers for a 50% upside - Business Today",Business Today,0.296,Positive
2023-03-29,HDFC Bank revises interest rates on non-withdrawable fixed deposits (FDs) effective from today - Mint,Mint,0.7269,Positive
2023-03-30,"Stock market holiday: NSE, BSE to remain closed today on Holi 2023 - Mint",Mint,0.4019,Positive
2023-03-31,"Sensex, Nifty Snap Three Months Of Consecutive Decline To End March Higher: Market Wrap - NDTV Profit",NDTV Profit,0.6808,Positive
2023-03-31,From Citibank to setting up HDFC Bank: Behind Aditya Puri's exceptional banking career - Business Today,Business Today,0.0,Neutral
2023-04-01,NSE reduces Bank Nifty lot size to 15 from July 2023 expiry - Mint,Mint,0.4019,Positive
2023-04-03,"HDFC Bank's total advances record 17% growth to ₹16,005 bn in Q4FY23 | Company Business News - Mint",Mint,0.3818,Positive
2023-04-05,HDFC Bank share price up over 2% on healthy deposit growth - Mint,Mint,0.7579,Positive
2023-04-05,"HDFC Bank Shares Rose 2% as Advances, Deposits Surge - Equitypandit",Equitypandit,0.296,Positive
2023-04-05,"Q4 results dates: TCS, Infosys, HDFC Bank, ICICI Bank to share quarterly earnings soon. Full details - Business Today",Business Today,0.296,Positive
2023-04-05,HDFC Bank garners record Rs 1.5 trillion deposits in a quarter - Business Standard,Business Standard,0.0,Neutral
2023-04-07,"ITC, HAL, ICICI Bank: Marathon Trends’ Atul Suri talks about his top 10 PMS holdings; do you own any? - Business Today",Business Today,0.2023,Positive
2023-04-10,"Tata Consultancy Services, Infosys, HDFC Bank And Others To Release Q4 FY 23 Results This Week: A Look At The - India.Com",India.Com,0.0,Neutral
2023-04-11,Wall Street Banks Expected to Report Weak Quarterly Earnings Following Global Bank Crisis - Equitypandit,Equitypandit,-0.7906,Negative
2023-04-12,"Natural gas stocks rally on hopes of CNG, PNG price cut to aid demand; IGL soars 3%, GAIL up 2.5% - Mint",Mint,0.4019,Positive
2023-04-12,HDFC Bank ties up with Export Import Bank of Korea for $300 mn credit line - Business Standard,Business Standard,0.3818,Positive
2023-04-13,"National Savings Scheme (NSC) offers 7.7% interest for June quarter of 2023: Income tax benefits, other details - The Economic Times",The Economic Times,0.6808,Positive
2023-04-13,"Infosys, TCS, RIL, HDFC Bank, other stocks to watch on April 13, 2023 - Business Today",Business Today,0.0,Neutral
2023-04-15,"HDFC Bank records 20% rise in Q4 PAT to ₹12,047.5 cr, NII jumps 24% - Mint",Mint,0.0,Neutral
2023-04-15,"HDFC Bank Q4 results: NII grows by 24%, PAT up 20% YoY, dividend of Rs 19/share declared - Business Today",Business Today,0.0,Neutral
2023-04-15,"HDFC Bank Q4: From interest income, provisions, hiring to asset quality, 10 key highlights of the quarter - Mint",Mint,0.6705,Positive
2023-04-17,HDFC Bank shares fall over 2% after Q4 numbers miss D-St estimates. Should you buy or sell? - Mint,Mint,0.1531,Positive
2023-04-17,HDFC Bank’s costs soar on new branches - Mint,Mint,0.0,Neutral
2023-04-17,"fund transfer: How to transfer funds from bank account to PPF, Sukanya Samriddhi Yojana, post office savings account without adding beneficiary - Transfers made easy - The Economic Times",The Economic Times,0.089,Positive
2023-04-17,ICICI Bank to raise funds via debt securities; stock up - Fortune India,Fortune India,-0.0772,Negative
2023-04-17,"HDFC Bank Down Over 2% As Q4 Result Leaves D-St Unimpressed; Buy, Hold or Sell? - News18",News18,-0.34,Negative
2023-04-18,How to safeguard your savings from bank failures - The Economic Times,The Economic Times,-0.1027,Negative
2023-04-19,Why you should open fixed deposit (FD) in post office instead of other banks - Mint,Mint,0.0,Neutral
2023-04-20,RBI approves appointment of Kaizad Bharucha as deputy MD of HDFC Bank - Business Standard,Business Standard,0.4019,Positive
2023-04-20,"Ahead of its merger with HDFC, 2 top executive appointments at HDFC Bank - Mint",Mint,0.2023,Positive
2023-04-21,"RBI asks HDFC Bank to comply with CRR, SLR, LCR post HDFC merger - BusinessLine",BusinessLine,0.0,Neutral
2023-04-21,"Reliance Industries Q4 results: Check date, time, preview, and estimates - Business Today",Business Today,0.0,Neutral
2023-04-21,Cipla and HDFC allot shares to employees for stock options - HR Katha,HR Katha,0.296,Positive
2023-04-22,"HDFC Bank, Axis Bank signs definitive agreements with Go Digit Life Insurance - Mint",Mint,0.2732,Positive
2023-04-22,SEBI approves transfer of controlling stake of HDFC AMC to HDFC Bank - ETLegalWorld.com,ETLegalWorld.com,0.4019,Positive
2023-04-22,"ICICI Bank Q4 results beat estimates net profit rises 30%, Rs 8 dividend announced - CNBC TV18",CNBC TV18,0.4404,Positive
2023-04-22,HDFC Bank Gets Post-Merger Relief - Equitypandit,Equitypandit,0.4767,Positive
2023-04-22,In the run-up to merger: HDFC Bank gets RBI relief on PSL norms - Business Standard,Business Standard,0.4767,Positive
2023-04-24,HDFC Bank: Ride On India's Growth Story With Its Leading Bank (NYSE:HDB) - Seeking Alpha,Seeking Alpha,0.3818,Positive
2023-04-24,IndusInd Bank Q4 results: Net profit jumps 46%; lender declares Rs 14 dividend - Business Today,Business Today,0.4404,Positive
2023-04-24,"Sensex rises over 150 points, Nifty tops 17,650; Mirza International, HDFC Life & Raymond jump up to 8% - Business Today",Business Today,0.7184,Positive
2023-04-24,HDFC Life Share Soars 8% as RBI Raises Stake After Merger of HDFC Twins - Equitypandit,Equitypandit,0.296,Positive
2023-04-24,Brokerages bullish on HDFC Bank stock following RBI's clarifications on its proposed merger - Mint,Mint,0.0,Neutral
2023-04-24,HDFC Life Insurance shares jump 8% at open; here's what fuelling the upward move - Business Today,Business Today,0.296,Positive
2023-04-24,HDFC Life Insurance stock jumps up to 8% today – Check the reason for the uptrend - Trade Brains,Trade Brains,0.0,Neutral
2023-04-25,"How IKEA Chopped, Hollowed Out and Flattened Its Furniture to Cut Costs | Company Business News - Mint",Mint,-0.2732,Negative
2023-04-25,"Stocks To Watch: Bajaj Auto, Nestle India, IIFL Securities, Tata Consumer, Crompton Greaves, HDFC Bank - NDTV Profit",NDTV Profit,0.6249,Positive
2023-04-26,Bourses approves transfer of NCDs from HDFC Ltd to Bank as part of merger - Business Standard,Business Standard,0.4019,Positive
