date,headline,source,compound,sentiment
2024-09-12,"RBI's stern warning to HDFC Bank: Rein in recovery agents, respect borrower privacy - Mint",Mint,0.1779,Positive
2024-09-12,"Shree Tirupati Balajee share price hits upper circuit after positive debut on Dalal Street. Buy, sell or hold? - Mint",Mint,0.7003,Positive
2024-09-12,"Stock market: Why Sensex, Nifty surged today; what's ahead? - Business Today",Business Today,0.4019,Positive
2024-09-12,Banking Stocks to Invest In India 2024 - India Infoline,India Infoline,0.0,Neutral
2024-09-12,Fixed Deposit rates above 8%: These small finance banks are offering over 1% higher FD rates than big ban - The Times of India,The Times of India,-0.5574,Negative
2024-09-12,HDFC Bank in talks with several global banks to offload $1 billion in loans - The Times of India,The Times of India,0.0,Neutral
2024-09-13,"Trading strategies in stocks that turned ex-bonus, split this week - Business Standard",Business Standard,0.0,Neutral
2024-09-13,"Top mutual funds sell over Rs 8,200 crore worth of HDFC Bank shares in August - Moneycontrol.com",Moneycontrol.com,0.5994,Positive
2024-09-13,Beware! NSE warns of WhatsApp scamsters luring investors with shares at discounted prices after market hours - Mint,Mint,0.3164,Positive
2024-09-14,Is the Indian stock market closed on Monday for Eid? - Mint,Mint,0.0,Neutral
2024-09-14,HDFC Bank Fixed Deposit interest rates 2024 – Check latest FD rates - The Financial Express,The Financial Express,0.4588,Positive
2024-09-15,"Stocks to buy for long term: HDFC Bank, SBI...Nirmal Bang recommends these 5 shares to buy, expects 9-61% upside - Mint",Mint,0.4767,Positive
2024-09-16,"HDFC Bank aims to boost income of 500,000 farmers by 2025 via CSR initiative - The Financial Express",The Financial Express,0.4019,Positive
2024-09-16,Top stocks bought and sold by mutual funds in August - CNBC TV18,CNBC TV18,0.2023,Positive
2024-09-17,"HDFC Bank - RIL, SBI, TCS among top 10 stock holdings of SBI Mutual Fund in August - The Economic Times",The Economic Times,0.2023,Positive
2024-09-17,Understanding portfolio churning: Why Quant Mutual Fund exited HDFC Bank shares in August - CNBC TV18,CNBC TV18,0.296,Positive
2024-09-18,PhonePe tops UPI market share in August - The Financial Express,The Financial Express,0.6705,Positive
2024-09-18,Reliance Infra shares hit 20% upper circuit level; here's what analysts say - Business Today,Business Today,0.296,Positive
2024-09-18,"ICICI Bank stock hits record high, market cap crosses ₹9 lakh crore for first time; What's driving the rally? - Mint",Mint,0.0,Neutral
2024-09-18,HDFC Bank FD interest rates - Up to 8.5% FD rate: SBI vs HDFC Bank vs ICICI Bank vs Canara Bank vs PNB latest fixed deposit interest rates September 2024 - The Economic Times,The Economic Times,0.7184,Positive
2024-09-18,"India becomes 6th largest market in MSCI ACWI, tops emerging markets list - Business Standard",Business Standard,0.5106,Positive
2024-09-19,"Godrej Capital targets Rs 17,000-crore AUM by March - The Financial Express",The Financial Express,0.0,Neutral
2024-09-19,"HDFC Pension AUM surpasses Rs 1 lakh crore, with 2.1 mn subscribers - Business Today",Business Today,0.0,Neutral
2024-09-20,HDFC Bank's subsidiary HDB Financial Services board clears IPO plans - Business Standard,Business Standard,0.0772,Positive
2024-09-20,MSTC climbs 4% after govt approves sale of arm FSNL for Rs 320 crore - Business Standard,Business Standard,0.4019,Positive
2024-09-20,"HDFC Bank Approves Rs 2,500 Crore IPO for HDB Financial Services - Rediff MoneyWiz",Rediff MoneyWiz,0.4019,Positive
2024-09-20,"HDFC Bank Arm HDB Financial Services Approves Rs 2,500 Crore IPO - outlookbusiness.com",outlookbusiness.com,0.4019,Positive
2024-09-20,"HDFC unit HDB Financial Services approves raising Rs 2,500 cr via IPO - Business Standard",Business Standard,0.4019,Positive
2024-09-20,"HDB Financial IPO: HDFC Bank clears subsidiary's IPO plan to raise ₹2,500 crore via fresh issue plus OFS - Mint",Mint,0.3818,Positive
2024-09-20,"HDFC Bank approves IPO of HDB Financial Services with fresh equity sale of Rs 2,500 crore - The Economic Times",The Economic Times,0.6124,Positive
2024-09-20,"Are interest rate cuts good for bank stocks? Well, it is a double-edged sword! - The Economic Times",The Economic Times,0.7263,Positive
2024-09-20,Magic of compounding: ₹1 lakh invested in this mutual fund scheme 28 years ago turned into ₹3.4 crore; check details - Mint,Mint,0.0,Neutral
2024-09-20,"HDB Financial board okays IPO; Rs 2,500-crore fresh issue, offer for sale on cards - Moneycontrol.com",Moneycontrol.com,0.6597,Positive
2024-09-22,HDFC Bank shares rise as Board approves HDB Financial IPO; check details - Upstox,Upstox,0.5994,Positive
2024-09-23,"HDFC Bank, Maruti Suzuki & Jio Financial Services - Hidden Gems or Traps - Investing.com India",Investing.com India,0.0,Neutral
2024-09-23,Top 9 fuel credit cards in India September 2024 - The Economic Times,The Economic Times,0.5267,Positive
2024-09-23,Balancing numbers and serenity: HDFC Bank CFO Srinivasan Vaidyanathan’s journey from finance to philosophy - The Financial Express,The Financial Express,0.0,Neutral
2024-09-23,Bajaj Housing Finance not to crack down in a major way in near to medium term: Amnish Aggarwal - The Economic Times,The Economic Times,0.0,Neutral
2024-09-23,Pros and Cons of Investing in HDFC Bank Right Now - Equitymaster,Equitymaster,0.0,Neutral
2024-09-23,Hot IPO Ahead! India's Largest Bank Okays $8 Billion Public Offer Of HDB Financial; HDFC Bank Stock Rises - Goodreturns,Goodreturns,0.5255,Positive
2024-09-24,Private bank stocks are outperforming PSU banks. Will the momentum last? - The Economic Times,The Economic Times,0.0,Neutral
2024-09-25,HDFC Bank's loan growth in Q2 could dip below 10%: Macquarie Report - Business Standard,Business Standard,0.3818,Positive
2024-09-25,"ATM cash deposit limit: What is the latest daily cash deposit limit for HDFC Bank, SBI, PNB, Union Bank o - The Times of India",The Times of India,0.0,Neutral
2024-09-25,UBS Group completes acquisition of HDFC Bank shares valued at Rs 543 cr - Business Standard,Business Standard,0.6249,Positive
2024-09-25,Promoter Nishant Pitti sells 14% stake in EaseMyTrip for Rs 920 cr - Business Standard,Business Standard,0.0,Neutral
2024-09-25,How much cash can you deposit in a savings account to avoid tax scrutiny? - The Financial Express,The Financial Express,-0.296,Negative
2024-09-25,KRN Heat Exchanger IPO fully subscribed within the first half-hour of day 1 - Mint,Mint,0.0,Neutral
2024-09-25,Brokers pitch for more sponsor banks in IPOs - The Financial Express,The Financial Express,0.0,Neutral
2024-09-26,"Brokerage Views: Goldman Sachs Picks 20 Indian Stocks, HSBC Hikes HDFC Bank Target Price And More - NDTV Profit",NDTV Profit,0.4877,Positive
2024-09-26,HDFC Bank picks Rs 1 crore worth of stake in SME IPO with 64% GMP - The Economic Times,The Economic Times,0.2263,Positive
2024-09-26,"Flipkart Big Billion Days 2024: Instant discounts, No Cost EMI options available for THESE cardholders - The Financial Express",The Financial Express,-0.296,Negative
2024-09-26,HDFC Bank sells home loans worth $717 million to ease credit load - Mint,Mint,0.7184,Positive
2024-09-26,"Nifty 50 September rejig: Bharat Electronics, Trent to enter NSE index on Sept 27; Divi's Lab, LTIMindtree excluded - Mint",Mint,0.0772,Positive
2024-09-26,"Manba Finance IPO allotment today: Check status, GMP, likely listing price - Business Standard",Business Standard,0.0,Neutral
2024-09-27,Staffing power up: HDFC Bank likely to overtake SBI in employee count - Business Standard,Business Standard,0.0,Neutral
2024-09-27,"UBS maintains ‘Buy’ on HDFC Bank, expects 18% upside - Business Upturn",Business Upturn,0.0,Neutral
2024-09-27,"HDFC Bank sells Rs 6,000 crore home loans - The Times of India",The Times of India,0.0,Neutral
2024-09-27,HDFC Bank shares on verge of breakout. How to trade? - The Economic Times,The Economic Times,0.296,Positive
2024-09-30,IDFC shares in focus following completion of merger with IDFC First Bank - The Economic Times,The Economic Times,0.296,Positive
2024-10-01,HDFC Bank Credit Card Rule Changes: Check new reward points system - The Financial Express,The Financial Express,0.743,Positive
2024-10-02,"Groww results: Net profits surge 308%, revenue at ₹2,900 crore in FY24, says report - Mint",Mint,0.4404,Positive
2024-10-03,"Morgan Stanley, Citigroup buy HDFC Bank shares worth ₹755 crore - Upstox",Upstox,0.4767,Positive
2024-10-03,"Morgan Stanley, Citigroup buy HDFC Bank shares worth ₹755 crore - CNBC TV18",CNBC TV18,0.4767,Positive
2024-10-03,HDFC Bank Q2 update: Gross advances grow 7% YoY; CASA deposits rise 8% YoY - Upstox,Upstox,-0.4767,Negative
2024-10-03,"Bumper Listing! KRN Heat Exchanger shares list at ₹480 on NSE, an over 118% premium to IPO price - Mint",Mint,0.3595,Positive
2024-10-04,"Sahasra Electron Sol Share Price Today, Sahasra Electron Sol Stock Price Live NSE/BSE Updates - The Economic Times",The Economic Times,0.296,Positive
2024-10-04,HDFC Bank shares rise amid likely MSCI-related inflows worth $1.8 bn in November - Moneycontrol.com,Moneycontrol.com,0.4767,Positive
2024-10-04,HDFC Bank says sequential rise in deposits outpaced loan growth in Q2 - Business Standard,Business Standard,0.3818,Positive
2024-10-04,"FIIs unwind Nifty longs, add shorts in Bank Nifty; Experts see more pain - Business Standard",Business Standard,0.204,Positive
2024-10-04,How does the recent HDFC Bank shareholding pattern impact MSCI adjustments? - CNBC TV18,CNBC TV18,0.0,Neutral
2024-10-05,Top 10 Dividend Stocks to Watch Out for in 2025 - Equitymaster,Equitymaster,0.2023,Positive
2024-10-06,"HDFC Bank, Titan, IndusInd, Godrej Properties, Adani Wilmar: Top Stocks To Watch for October 7 - CNBC TV18",CNBC TV18,0.2023,Positive
2024-10-07,HDFC Bank approves 100% stake sale of subsidiary HDFC Education to Vama Sundari Investments for ₹192 crore - Mint,Mint,0.4019,Positive
2024-10-07,HDFC Bank board okays sale of 100% stake in HDFC Edu to Vama Sundari for ₹192 crore - CNBC TV18,CNBC TV18,0.4767,Positive
2024-10-07,RBI draft proposals on aligning businesses may impact private banks - Business Standard,Business Standard,0.0,Neutral
2024-10-07,What triggered the sharp fall in HDFC Bank shares after a brief recovery? - CNBC TV18,CNBC TV18,0.296,Positive
2024-10-07,HDFC Bank divests 100% stake in HDFC Edu for Rs 192 crore - The Economic Times,The Economic Times,0.0,Neutral
2024-10-08,"Sebi greenlights NSDL IPO: NSE, HDFC Bank among others to pare stakes - Business Standard",Business Standard,0.0,Neutral
2024-10-08,"SEBI approves much-awaited Rs 3,000 crore-NSDL IPO; HDFC Bank shares gain - Moneycontrol.com",Moneycontrol.com,0.8074,Positive
2024-10-08,"Stocks to Watch: Northern Arc, Tata Motors, Ola Electric, Morepen Labs, BoB - Business Standard",Business Standard,0.0,Neutral
2024-10-08,HDFC Bank Divests 100% Stake in HDFC Edu for ₹192 Crore - Adda247,Adda247,0.0,Neutral
2024-10-08,"HDFC Bank, ICICI Bank to Axis Bank: Why are banking shares rising in stock market today? - Mint",Mint,0.296,Positive
2024-10-08,"IPO: NSDL Gets SEBI Nod; NSE, SBI, HDFC Bank To Sell Shares - Moneylife",Moneylife,0.296,Positive
2024-10-08,"Sebi approves NSDL IPO, HDFC Bank to pare stake - The Economic Times",The Economic Times,0.4019,Positive
2024-10-08,"NSDL gets Sebi nod to float IPO; NSE, HDFC Bank, SBI to pare stakes - The Hindu",The Hindu,0.0,Neutral
2024-10-09,HDFC Bank Limited (HDB): Among the Best Indian Stocks for the Next 10 Years - Yahoo Finance,Yahoo Finance,0.5106,Positive
2024-10-09,"IDFC First Bank, IDFC merger: Will it influence Nifty Bank stocks? - Business Today",Business Today,0.4019,Positive
2024-10-09,FD interest rates: These 6 banks offer highest returns on fixed deposits; check details - Mint,Mint,0.4588,Positive
2024-10-09,"IDFC First Bank merger record date tomorrow, weightage in Nifty Bank to increase - The Economic Times",The Economic Times,0.6124,Positive
2024-10-09,"IDFC Ltd Share Price Today,, IDFC Share Price NSE, BSE - Business Today",Business Today,0.5267,Positive
2024-10-11,Top 4 Stocks that Could Benefit from the Upcoming IPO of NSDL - Equitymaster,Equitymaster,0.5859,Positive
2024-10-14,"SEBI approves ₹3,000 crore NSDL IPO: Here’s a list of banks likely to divest their stake via OFS - Upstox",Upstox,0.4019,Positive
2024-10-14,"HDFC Bank Q2 Results 2024: Date, Time, and Where to Watch - The Financial Express",The Financial Express,0.0,Neutral
2024-10-14,Top 5 Banking Stocks That Should be on Your Radar for 2025 - Equitymaster,Equitymaster,0.2023,Positive
2024-10-14,"PVR Inox to declare Q2 results today; check stock's performance, recent updates and Q1 earnings - Upstox",Upstox,0.0,Neutral
2024-10-15,"HDFC AMC Q2 results: Net profit rises 32% to ₹577 crore, revenue up 38% - Mint",Mint,0.4404,Positive
2024-10-16,"Q2 results today: Bajaj Auto, L&T Technology Services, CRISIL among companies to post earnings; check list - Upstox",Upstox,0.0,Neutral
2024-10-17,HDFC Securities enters wealth advisory business with launch of HDFC Tru - Business Standard,Business Standard,0.6597,Positive
2024-10-17,"Axis Bank Q2 results: Profit may jump 7-14%, NIM seen at 4%; here're key expectations - Business Today",Business Today,0.4404,Positive
2024-10-17,HDFC Bank Inaugurated its First Branch in Singapore - marketscreener.com,marketscreener.com,0.0,Neutral
2024-10-18,"HDFC Bank Q2 preview: Net profit likely to grow nearly 4% at Rs 16,570 crore - Moneycontrol.com",Moneycontrol.com,0.4404,Positive
2024-10-18,HDFC Bank Q2 results preview: Net profit expected to see modest increase; NIM and asset quality in focus - CNBC TV18,CNBC TV18,0.7717,Positive
2024-10-18,Kotak Mahindra Bank Q2 results preview: NII and net profit to see muted growth; check details - Upstox,Upstox,0.6705,Positive
2024-10-19,"HDFC Bank board approves Rs 12,500-crore share sale of its subsidiary HDB Financial - The Times of India",The Times of India,0.5994,Positive
2024-10-19,"HDFC Bank to offload Rs 10,000 cr worth stake in Rs 12,500 cr IPO of HDB Financial Services - The Economic Times",The Economic Times,0.2263,Positive
2024-10-19,"HDFC Bank Q2 results: Net profit rises 5% to Rs 16,820 crore, beats Street estimates - Moneycontrol.com",Moneycontrol.com,0.4404,Positive
2024-10-19,"HDB Financial Services IPO: HDFC Bank arm to float ₹12,500-crore IPO; parent to offload ₹10k-crore shares via OFS - Mint",Mint,0.296,Positive
2024-10-19,"HDFC Bank Q2FY25 results: Net profit increases 5% to Rs 16,820 cr - Business Standard",Business Standard,0.4404,Positive
2024-10-20,"HDFC Bank aims to reduce CD ratio, plans slower loan growth in FY25 - Business Standard",Business Standard,0.3818,Positive
2024-10-20,HDFC Bank says moderation in credit growth opportunity to improve loan-deposit ratio - Mint,Mint,0.872,Positive
2024-10-20,"HDB Financial Services to float ₹12,500 crore IPO, parent HDFC Bank to sell ₹10,000 crore worth of its shares in OFS | Business News - Hindustan Times",Hindustan Times,0.4767,Positive
2024-10-20,"Banking stocks biggest gainers among Top 10 as ICICI Bank, HDFC Bank and SBI shine - theweek.in",theweek.in,0.2023,Positive
2024-10-21,HDFC Bank may see a good re-rating over 3-4 years; Kotak Bank to remain range-bound: Rahul Malani - The Economic Times,The Economic Times,0.4404,Positive
2024-10-21,Buy HDFC Bank; target of Rs 2050: Motilal Oswal - Moneycontrol.com,Moneycontrol.com,0.0,Neutral
2024-10-21,"HDFC Bank shares zooms nearly 3% as board approves HDB Financial Services IPO worth Rs 12,500 cr - The Financial Express",The Financial Express,0.7003,Positive
2024-10-21,HDB Financial Services IPO: Parent HDFC Bank Shares a Major Update on Timeline - Equitymaster,Equitymaster,0.296,Positive
2024-10-21,"HDFC Bank has more re-rating potential than ICICI Bank: Santanu Chakrabarti, BNP Paribas - The Economic Times",The Economic Times,0.0,Neutral
2024-10-21,JPMorgan cautious on HDFC Bank stock as CASA growth slows and loan outlook dims - Investing.com Canada,Investing.com Canada,0.296,Positive
2024-10-21,"HDB Financial IPO: HDFC Bank's NBFC Arm To Raise Rs 12,500 Crore, HDFC To Offload Rs 10,000 Crore - Goodreturns",Goodreturns,0.0,Neutral
2024-10-21,"Bajaj Auto, HDFC Bank, Tech Mahindra Shine while Tata Consumer and IndusInd Bank Drag Nifty Down - topnews.in",topnews.in,0.2023,Positive
2024-10-21,Explained: Why HDFC Bank outshines Axis and Kotak Mahindra Bank in Q2FY25 - CNBC TV18,CNBC TV18,0.0,Neutral
2024-10-21,"HDFC Bank's board approves ₹12,500 cr IPO for HDB Financial; stock up 3% on steady Q2 - Fortune India",Fortune India,0.4019,Positive
2024-10-21,"RBL Bank share plunges 13%, hits 52-week low on weak Q2 results - Business Standard",Business Standard,-0.4215,Negative
2024-10-21,HDFC Bank stock up 3% post Q2 results as analysts raise share price target - Business Standard,Business Standard,0.296,Positive
2024-10-21,RBL Bank shares plunge over 13% after net profit falls 24%; Should you buy the dip? - The Financial Express,The Financial Express,0.6249,Positive
2024-10-21,"HDFC Bank okays Rs 12,500-crore IPO for its NBFC arm HDB Financial Services - The New Indian Express",The New Indian Express,0.4767,Positive
2024-10-22,UltraTech Cement up 2% as co eyes 7-8% growth in future; brokerages vary - Business Standard,Business Standard,0.3818,Positive
2024-10-22,The surprising reason for HDFC Bank's slowdown - LinkedIn,LinkedIn,0.2732,Positive
2024-10-22,"Adani Green Energy Q2 Results: Net Profit jumps 39% to ₹515 crore, total income up over 30% - Mint",Mint,0.6124,Positive
2024-10-22,Authum Investment & Infrastructure plunges 12% on weak Q2; profit drops 56% - Business Standard,Business Standard,0.0,Neutral
2024-10-23,Patience vs Payoff: What HDFC Bank’s investors can learn from Sachin Tendulkar - Mint,Mint,0.0,Neutral
2024-10-23,"Up to 7.25% savings account interest rate: SBI, HDFC Bank, ICICI Bank, PNB, Union Bank, IDFC FIRST Bank - The Economic Times",The Economic Times,0.4588,Positive
2024-10-24,Revenue gains and slippage pains: A Q2 FY25 recap for private banks - Upstox,Upstox,-0.1027,Negative
2024-10-24,"ITC Q2 Results: Net profit rises 3% to ₹5,078 crore, revenue up 17% YoY; 5 key highlights - Mint",Mint,0.4404,Positive
2024-10-24,Tata Communications up 3% on tie up with Nvidia for AI cloud infra in India - Business Standard,Business Standard,0.0,Neutral
2024-10-24,"HDFC Bank Ltd Share Price: Forecast, History, Chart and Target - Analytics Insight",Analytics Insight,0.296,Positive
2024-10-26,HDFC Bank: The Clouds Are Finally Clearing (Rating Upgrade) (NYSE:HDB) - Seeking Alpha,Seeking Alpha,0.0,Neutral
2024-10-26,"Busy with Diwali, Dhanteras shopping? Check THESE top credit card offers on SBI Card, ICICI Bank, Axis Bank, HDFC Bank - Mint",Mint,0.5267,Positive
2024-10-26,Priyanka Gandhi has invested in single mutual fund worth crores and holds shares of these companies in her po - India.Com,India.Com,-0.128,Negative
2024-10-28,"What is digital arrest scam, six tips from HDFC Bank to protect yourself from this financial fraud - The Economic Times",The Economic Times,-0.8074,Negative
2024-10-28,HDFC Bank advises customers to stay vigilant against digital arrests - Business Standard,Business Standard,-0.296,Negative
2024-10-28,Waaree Energies Shares List at 66% Premium on NSE After a Record Breaking IPO Subscription - Mint,Mint,0.4767,Positive
2024-10-28,How banks fared in the second quarter of FY25 - CNBC TV18,CNBC TV18,0.0,Neutral
2024-10-28,"Diwali 2024 Stock Picks: HDFC Bank, M&M to Hyundai Motor — Arihant Capital lists 15 stocks to buy for Samvat 2081 - Mint",Mint,0.0,Neutral
2024-10-29,"Top travel credit cards with airport lounge access, discounts on airfare, business class vouchers: SBI Card, Axis Bank, HDFC Bank - Top travel credit cards - The Economic Times",The Economic Times,0.7783,Positive
2024-10-30,"Hdfc Bank Share Price Today on 30-10-2024: Hdfc Bank share price are down by -0.91%, Nifty down by -0.51% - Mint",Mint,0.7269,Positive
2024-10-31,HDB Financial IPO: 10 key things to know as HDFC Bank's NBFC arm prepares for stock market debut - Moneycontrol.com,Moneycontrol.com,0.0,Neutral
2024-10-31,"HDB Financial, a unit of HDFC Bank, files for Rs 12,500 crore IPO - Business Standard",Business Standard,0.0,Neutral
2024-10-31,Upcoming IPO: HDFC Bank's NBFC arm HDB Financial Services files DRHP for IPO with SEBI - Mint,Mint,0.0,Neutral
2024-11-01,HDFC Bank Share Price Target 2025: India's most valuable bank is TOP Muhurat pick by brokerage - ET Now,ET Now,0.7979,Positive
2024-11-01,HDFC Bank credit card limited period offer: Get these 5 credit cards for zero joining fee and annual fee - The Economic Times,The Economic Times,0.5106,Positive
2024-11-01,Muhurat Trading 2024: SBI vs ICICI Bank vs HDFC Bank - Which bank stock can become game changer for Samvat 2081? - ET Now,ET Now,0.0,Neutral
2024-11-02,HDB Financial Services IPO: Two concerns that could hurt the HDFC Bank subsidiary’s valuation | Company Business News - Mint,Mint,-0.5267,Negative
2024-11-02,Top 5 Stocks That Reported Strong Earnings in a Disappointing Earnings Season - Equitymaster,Equitymaster,0.2263,Positive
2024-11-03,"36% companies in Nifty 50 miss estimates in Sep quarter, shows data - Business Standard",Business Standard,0.2732,Positive
2024-11-04,Earnings review: Three takeaways from banks’ Q2 results | Mint - Mint,Mint,0.0,Neutral
2024-11-04,"SAR Televenture to acquire Tikona Infinet for Rs 669 cr in cash, stock deal - Business Standard",Business Standard,0.0,Neutral
2024-11-05,"SBI Q2 Results FY 2024-25 Date and Time: Quarterly earnings, analyst meet schedule of State Bank of India - ET Now",ET Now,0.0,Neutral
2024-11-05,"GAIL India Q2 Results: Net profit rises 10% to ₹2,689.67 crore, revenue up marginally - Mint",Mint,0.4404,Positive
2024-11-05,FD interest rates: These 7 banks offer highest interest on their fixed deposits - Mint,Mint,0.7184,Positive
2024-11-06,"Max Healthcare Q2: Net profit up 1.9% at Rs 281.81 cr, revenue rises 25% - Business Standard",Business Standard,0.4404,Positive
2024-11-06,"Buy Federal Bank, target price Rs 224-240 over 6-9 months: HDFC Securities - The Economic Times",The Economic Times,0.296,Positive
2024-11-06,"Tata Steel Q2 Results: Steelmaker posts net profit of ₹833 crore vs loss YoY, revenue falls 3%; Key highlights - Mint",Mint,0.1531,Positive
2024-11-07,"MSCI November rejig review: BSE, 4 others added; HDFC Bank weight to rise - Business Standard",Business Standard,0.0,Neutral
2024-11-07,5 Bank stocks with high Loan-to-Deposit ratio; Do you own any? - Trade Brains,Trade Brains,0.0,Neutral
2024-11-07,Investing in Banking Stocks in India: Key Insights and Top Picks - India Infoline,India Infoline,0.2023,Positive
2024-11-07,"Apollo Hospitals zooms 6%, hits lifetime high after stellar Q2 results - Business Standard",Business Standard,0.0,Neutral
2024-11-08,"SBI Q2 Results: Net profit rises 28% YoY to ₹18,331.4 crore, NII up 5.37%; 6 key highlights - Mint",Mint,0.4404,Positive
2024-11-08,"SBI Q2 Results: PAT jumps 28% YoY to Rs 18,331 crore, beats estimates - The Economic Times",The Economic Times,0.0,Neutral
2024-11-09,Is HDFC Bank One of the Top Banking Stocks in India? - Equitymaster,Equitymaster,0.2023,Positive
2024-11-09,"Q2 results today: Asian Paints, Divis Labs, TVS Electronics, Aurobindo Pharma & Uttkarsh Small Finance Bank among others - Mint",Mint,0.0,Neutral
2024-11-11,Earnings misses pile up: Over half of Nifty 50 companies fall short of expectations - Moneycontrol.com,Moneycontrol.com,0.2023,Positive
2024-11-12,"HDFC Bank's Stock Price Dips, But Remains Strong Investment Option for Investors - Markets Mojo",Markets Mojo,0.6652,Positive
2024-11-12,What is weighing down stock market: Key factors behind the decline - The Times of India,The Times of India,0.0,Neutral
2024-11-12,"Q2FY25 results review: PNB, BoB to Canara Bank — Profit of PSBs jumps 35.4% to ₹45,550 crore - Mint",Mint,0.4404,Positive
2024-11-13,"SBI, HDFC Bank, ICICI Bank continue to be systemically important: RBI - Business Standard",Business Standard,0.2023,Positive
2024-11-13,"RBI says SBI, HDFC Bank and ICICI Bank continue to be identified as Domestic Systemically Important Banks - Business Standard",Business Standard,0.2023,Positive
2024-11-13,"SBI, HDFC Bank, ICICI Bank retained in RBI’s list of ‘too-big-to-fail’ banks - Business Today",Business Today,0.0258,Neutral
2024-11-13,Bloodbath on D-street: Investors lose Rs 13 lakh crore in last 2 days- Top reasons why market is falling - The Times of India,The Times of India,-0.3612,Negative
2024-11-13,"RBI retains SBI, HDFC, ICICI as India's too-big-to-fail banks - Mint",Mint,0.0,Neutral
2024-11-13,"SBI, HDFC Bank and ICICI remain RBI's Systemically Important Banks - The Economic Times",The Economic Times,0.2023,Positive
2024-11-13,"SBI, HDFC, ICICI remain Domestic Systemically Important Banks in 2024: RBI - Business Standard",Business Standard,0.2023,Positive
2024-11-14,"Lemon Tree Hotels Q2 Results: Net profit rises 33% YoY to ₹35 crore, revenue up 24% - Mint",Mint,0.4404,Positive
2024-11-14,"Preventing cyber frauds: HDFC Bank’s ‘Vigil Aunty’ shares how she helps people ‘Stay Safe, Stay Vigil’ at - The Times of India",The Times of India,0.5106,Positive
2024-11-14,"Yes Bank cuts FD interest rates: Comparing fixed deposit rates with SBI, HDFC Bank, ICICI Bank, Canara Bank, PNB - The Economic Times",The Economic Times,0.5423,Positive
2024-11-14,"Beware of cyber frauds! How a simple call, SMS can lead to financial loss - Dr Rakshit Tandon shares impo - The Times of India",The Times of India,-0.5707,Negative
2024-11-14,"Glenmark Pharma Q2 Results: Pharma major posts net profit of ₹354.48 crore, revenue up 7.5% YoY - Mint",Mint,0.4877,Positive
