date,headline,source,compound,sentiment
2025-07-15,HDB Financial Q1 Results: Profit declines 2.4% YoY to ₹568 crore in first earnings announcement post listing - Mint,Mint,0.4404,Positive
2025-07-15,India's HDFC Bank to consider issuing bonus shares - Reuters,Reuters,0.6908,Positive
2025-07-15,India's stock benchmarks open flat as gains in HDFC Bank offset broader losses - TradingView,TradingView,-0.0772,Negative
2025-07-15,"From HCL Tech, Tata Tech, Ola Electric to RVNL – Here are 10 stocks to watch - The Financial Express",The Financial Express,0.0,Neutral
2025-07-16,HDFC Bank to Consider First-Ever Bonus Issue on July 19 - NiftyTrader,NiftyTrader,0.5423,Positive
2025-07-16,HDFC Bank’s Board to Consider Issue of Bonus Shares on July 19 - Bloomberg.com,Bloomberg.com,0.6908,Positive
2025-07-16,"HDFC Bank to Consider Special Interim Dividend, Bonus Issue on July 19, Along With Q1 Results - Moneycontrol.com",Moneycontrol.com,0.7351,Positive
2025-07-16,HDFC Bank Stock Up 1% Today - Here’s Why Investors Are Watching July 19 Closely - Republic World,Republic World,0.0,Neutral
2025-07-16,"HDFC Bank stock up 1% as board to mull bonus, special dividend on July 19 - Business Standard",Business Standard,0.7351,Positive
2025-07-16,"HDB Financial shares slip 4% post Q1 results; should you buy, sell or hold? - Business Standard",Business Standard,0.296,Positive
2025-07-16,"HDFC Bank board to consider bonus issue, special dividend as Q1 results set for July 19 - Upstox",Upstox,0.7351,Positive
2025-07-16,Here's why Network 18 share price is buzzing in trade today; details here - Business Standard,Business Standard,0.296,Positive
2025-07-16,"From HDB Financial, Star Health, HDFC Life to Dixon Tech – Here are 10 stocks to watch - The Financial Express",The Financial Express,0.0,Neutral
2025-07-16,How to trade HDFC Bank stock ahead of bonus issue meet? Key levels to track - Business Standard,Business Standard,0.5423,Positive
2025-07-16,HDFC Bank first-ever bonus share issue: Key decision expected on this day - check details - The Times of India,The Times of India,0.6908,Positive
2025-07-16,HDFC Bank to Review Bonus Issue and Special Dividend July 19 - HDFC Sky,HDFC Sky,0.7351,Positive
2025-07-16,"Bonus Alert: HDFC Bank to consider first ever free share issue, special dividend on July 19 - CNBC TV18",CNBC TV18,0.9169,Positive
2025-07-16,HDFC Bank to consider first-ever bonus share issue on July 19; stock reacts positively - Fortune India,Fortune India,0.8442,Positive
2025-07-16,"HDFC Bank considers bonus shares, special interim dividend on July 19 - BusinessLine",BusinessLine,0.8126,Positive
2025-07-16,HDFC Bank bonus shares explained: How they differ from a stock split - Business Today,Business Today,0.6908,Positive
2025-07-16,"Wipro, Axis Bank, LTIMindtree, IHCL, HDFC AMC: Q1 results preview - Business Today",Business Today,0.0,Neutral
2025-07-16,"HDFC Bank Share Price Today NSE, BSE: Stock gains as board to consider special dividend, bonus issue soon - India TV News",India TV News,0.8689,Positive
2025-07-16,HDFC Bank Bonus Share Buzz: Is banking behemoth preparing first ever such payout? What investors can expect in earnings on July 19 - Zee Business,Zee Business,0.6908,Positive
2025-07-16,"HDFC Bank bonus shares, dividend: LIC, other key investors; dividend history & more - Business Today",Business Today,0.6908,Positive
2025-07-16,HDFC Bank Bonus Issue & Dividend - Rediff MoneyWiz,Rediff MoneyWiz,0.5423,Positive
2025-07-16,Good news soon for HDFC Bank shareholders? Here's all you need to know - India Today,India Today,0.4404,Positive
2025-07-16,"HDFC Bank To Consider Bonus Share Issue, Special Interim Dividend On July 19 - NDTV Profit",NDTV Profit,0.8834,Positive
2025-07-16,HDFC Bank Board To Weigh Big Rewards: 1st Ever Bonus Issue And Special Interim Dividend In Focus On July 19 - Goodreturns,Goodreturns,0.8519,Positive
2025-07-16,"HDFC Bank to Consider First-ever Bonus Share Issue in Upcoming Board Meeting on July 19, 2025 - Groww",Groww,0.6908,Positive
2025-07-16,"In a first, HDFC Bank to consider issuing bonus shares on July 19 - BusinessLine",BusinessLine,0.6908,Positive
2025-07-16,HDFC Bank to consider its first-ever bonus issue: What it could mean for investors - Moneycontrol.com,Moneycontrol.com,0.5423,Positive
2025-07-16,HDFC Bank to consider first-ever bonus share issue on July 19 - The Economic Times,The Economic Times,0.6908,Positive
2025-07-16,HDFC Bank to consider its first-ever bonus issue of shares on July 19 - Moneycontrol.com,Moneycontrol.com,0.6908,Positive
2025-07-17,"HDFC Bank Q1 Preview: NII to grow in single-digit amid slower loan growth, margins may compress - Moneycontrol.com",Moneycontrol.com,0.3818,Positive
2025-07-17,"HDFC Bank Q1 Results Preview: Higher Provisions, Soft Loan Growth On Cards - NDTV Profit",NDTV Profit,0.6705,Positive
2025-07-17,"Stock Market Today: Flat-to-Positive Trading Likely; Nifty Support at 25,000, HDFC Bank Bonus Issue in Focus - Goodreturns",Goodreturns,0.836,Positive
2025-07-17,"Preview: HDFC Bank to announce Q1 results, bonus share, dividend on July 19 - Business Standard",Business Standard,0.6908,Positive
2025-07-17,HDFC Bank’s AI Strategy: Analysis of Dominating Banking AI - Klover.ai,Klover.ai,-0.296,Negative
2025-07-17,"Results-bound stocks: Wipro, Axis Bank, LTIM, IHCL range-bound ahead of Q1 earnings - Business Today",Business Today,0.0,Neutral
2025-07-17,HDFC board to consider 1st ever bonus stock issue - The Times of India,The Times of India,0.5423,Positive
2025-07-18,"Bandhan Bank Q1 Results: Net profit down 65% to ₹372 crore, NII falls 7% YoY - Upstox",Upstox,0.4404,Positive
2025-07-18,"HDFC Bank Q1 results preview: Earnings, Bonus issue, Dividend, Technical structure & Options strategy - Upstox",Upstox,0.5423,Positive
2025-07-18,HDFC Bank bonus shares on July 19: A look at stocks that turned ex-bonus in 2025 - Business Today,Business Today,0.6908,Positive
2025-07-18,"HDFC Bank Q1 results preview: PAT, NII may grow by up to 6% YoY. 7 key things to watch out for - The Economic Times",The Economic Times,0.0,Neutral
2025-07-18,"HDFC Bank shares climb 19% in 6 months; analysts weigh in ahead of Q1 results, likely bonus issue - Business Today",Business Today,0.6908,Positive
2025-07-18,"Q1 FY26 Earnings Result: HDFC Bank, ICICI Bank, Yes Bank Among 19 Firms to Report on July 19 - HDFC Sky",HDFC Sky,0.4019,Positive
2025-07-18,"HDFC Bank Q1 results preview: Net profit, NII likely to grow 6% YoY; dividend, bonus issue in focus - Mint",Mint,0.7506,Positive
2025-07-18,"Q1 Results: ICICI Bank, HDFC Bank, YES Bank, RBL Bank, Reliance Power among 21 companies to announce earnings today, July 19 - Upstox",Upstox,0.5319,Positive
2025-07-18,ICICI Bank Q1 Results Preview: PAT seen to grow up to 12% YoY. NII could rise by up to 9% amid margin cont - The Economic Times,The Economic Times,0.0,Neutral
2025-07-18,Motilal Oswal picks top bank stocks to buy as sector eyes earnings rebound - Business Standard,Business Standard,0.2023,Positive
2025-07-19,HDFC Bank announces first ever bonus share issue at 1:1 ratio - The Economic Times,The Economic Times,0.6908,Positive
2025-07-19,"HDFC Bank bonus shares: What Rs 15,00,000 crore giant's 36 lakh investors should know - Business Today",Business Today,0.6908,Positive
2025-07-19,"RIL, YES Bank, Infosys, HDFC Bank, Bajaj Finance among stocks in focus next week - Business Today",Business Today,0.5319,Positive
2025-07-19,"HDFC Bank Q1 results: Net profit rises over 12%; board clears 1:1 bonus issue, special dividend - The Indian Express",The Indian Express,0.8555,Positive
2025-07-19,HDFC Bank Profit Beats Estimate Despite Higher Provision - Bloomberg.com,Bloomberg.com,0.4404,Positive
2025-07-19,"HDFC Bank Q1 result: Consolidated net profit down 1.3% at Rs 16,258 crore, standalone PAT rises to Rs 18, - The Times of India",The Times of India,0.4404,Positive
2025-07-19,HDFC Bank’s Bonus Shares and Special Interim Dividend Announced - getmoneyrich,getmoneyrich,0.8126,Positive
2025-07-19,HDFC Bank Bonus Issue: One Share For Every One Held — Board Approves Plan - NDTV Profit,NDTV Profit,0.8834,Positive
2025-07-19,HDFC Bank announces first-ever bonus to boost investor confidence - Forbes India,Forbes India,0.8591,Positive
2025-07-19,"Bonus, Dividend, and Strong Profits: HDFC Bank’s Triple Delight for Investors - The Financial Express",The Financial Express,0.9274,Positive
2025-07-19,HDFC Bank Q1 Net Rises 12% on Strong Income Growth; Board Approves Bonus Issue and Interim Dividend - The Times of India,The Times of India,0.9022,Positive
2025-07-19,HDFC Bank approves its first-ever bonus share; special dividend of ₹5 per share - The Hindu,The Hindu,0.9062,Positive
2025-07-19,"Q1 Results Today: HDFC Bank, ICICI Bank, Yes Bank, Reliance Power among 21 companies to announce earnings on 19 July - Mint",Mint,0.4019,Positive
2025-07-19,"HDFC Bank Q1 result preview: NIMs growth outlook, bonus issue in focus; concall timing - Business Today",Business Today,0.7269,Positive
2025-07-19,"1:1 Bonus Issue, Rs. 5 Special Interim Dividend: How To Set Up Trade For HDFC Bank Ahead of Record Date? - Goodreturns",Goodreturns,0.7351,Positive
2025-07-19,HDFC Bank Reports Mixed Financial Results Amid Record Earnings and Rising NPAs in June 2025 - Markets Mojo,Markets Mojo,0.0,Neutral
2025-07-19,"HDFC Bank, ICICI Bank likely to report weak Q1 on sluggish loan growth, weak margin | Mint - Mint",Mint,-0.7096,Negative
2025-07-19,HDFC Bank Q1 dividend announcement: Special interim dividend of ₹5 per share for FY26 declared - Mint,Mint,0.5994,Positive
2025-07-19,"ICICI Bank Q1 Results: Net profit rises 15.5% YoY to Rs 12,768 crore; NII up 11% - The Economic Times",The Economic Times,0.4404,Positive
2025-07-19,"ICICI Bank net up 15.5% on treasury gains, NII increases by 10.6% - Business Standard",Business Standard,0.4939,Positive
2025-07-19,"HDFC Bank vs ICICI Bank vs Axis Bank vs Bandhan Bank: Which bank stock offers high dividend, mcap and returns? - The Indian Express",The Indian Express,0.0,Neutral
2025-07-19,HDFC Bank shores up provisions as agri slippages rise; margins under pressure - Mint,Mint,-0.296,Negative
2025-07-19,"HDFC Bank Q1FY26 preview: First bonus issue to dividend, 5 factors to watch out for - The Financial Express",The Financial Express,0.5423,Positive
2025-07-19,"HDFC Bank Q1 FY26 Results: PAT beats forecasts at Rs 18,155 crore; first-ever bonus, Rs 5 dividend, other key takeaways - Zee Business",Zee Business,0.5423,Positive
2025-07-19,"HDFC Bank Q1 Results 2026: 500% special dividend, first bonus issue announced – Record date, ratio and other details - ET Now",ET Now,0.7351,Positive
2025-07-19,"ICICI Bank, HDFC Bank To Report Earnings On 19 July - BW Businessworld",BW Businessworld,0.0,Neutral
2025-07-19,"HDFC Bank Q1 Results 2026: Profit up over 12% YoY to Rs 18,155 cr – Check quarterly earnings, dividend details - ET Now",ET Now,0.4404,Positive
2025-07-19,"HDFC Bank Q1 Results: PAT rises 12% YoY to Rs 18,155 crore, NII up 5%; special dividend of Rs 5 per share - The Economic Times",The Economic Times,0.5994,Positive
2025-07-19,HDFC Bank Q1 Results: India's biggest private lender announces first-ever bonus share issue at 1:1 ratio. Check details - Mint,Mint,0.6908,Positive
2025-07-19,"Q1 results today: HDFC, ICICI Bank, Reliance Power, 18 others on July 19 - Business Standard",Business Standard,0.0,Neutral
2025-07-19,Q1 Earnings Face-Off: ICICI Bank Outshines HDFC as Provisions Drag Profit - outlookbusiness.com,outlookbusiness.com,0.25,Positive
2025-07-19,"Corporate earnings today (July 19): HDFC Bank, Reliance Power, ICICI Bank among 11 companies that announced Q1FY26 results - The Indian Express",The Indian Express,0.0,Neutral
2025-07-19,"HDFC Bank Q1 net profit up 12.2% on Rs 9,128 crore gain from HDB Financial IPO - Moneycontrol.com",Moneycontrol.com,0.743,Positive
2025-07-19,"HDFC Bank Bonus, Special Dividend: Board approves 1:1 issue, special dividend of ₹5 - CNBC TV18",CNBC TV18,0.891,Positive
2025-07-19,"HDFC Bank Q1 results: Net profit up 12.2% Y-o-Y to Rs 18,155 crore - Business Standard",Business Standard,0.4404,Positive
2025-07-19,"HDFC Bank Q1 results: Net profit rises 12%, NII advances 5%; bank announces bonus issue of 1:1 - Upstox",Upstox,0.7506,Positive
2025-07-19,"HDFC Bank announces first-ever 1:1 bonus issue, declares Rs 5 special interim dividend - Business Today",Business Today,0.7351,Positive
2025-07-19,"HDFC Bank announces bonus issue, special interim dividend in Q1; check details - Upstox",Upstox,0.7351,Positive
2025-07-20,HDFC Bank Bonus Issue: A Sweet Deal or Market Trap? - Equitymaster,Equitymaster,0.6369,Positive
2025-07-20,"HDFC Bank Reports 12% Profit Growth, Announces Bonus Issue and Dividend - India News Network",India News Network,0.8402,Positive
2025-07-20,"HDFC Bank Q1 FY26 Financial Results: Performance for Quarter June, 2025 - getmoneyrich",getmoneyrich,0.0,Neutral
2025-07-20,"How RIL, HDFC Bank and ICICI Bank may drive Monday's market move? Anand James shares insights - The Economic Times",The Economic Times,0.296,Positive
2025-07-20,"Trade Setup for July 21: Nifty trajectory on Monday to be determined by RIL, HDFC Bank and ICICI Bank shares - CNBC TV18",CNBC TV18,0.743,Positive
2025-07-20,"India's HDFC Bank, ICICI Bank rise on upbeat quarterly results - Yahoo Finance Singapore",Yahoo Finance Singapore,0.0,Neutral
2025-07-20,"Nifty 50 Top Gainers: Tata Steel, HDFC Bank, ICICI Bank shares lead index in today's trading session - TradingView",TradingView,0.6908,Positive
2025-07-20,"India's HDFC Bank, ICICI Bank rise on upbeat quarterly results - Reuters",Reuters,0.0,Neutral
2025-07-20,"Q1 results this week: Infosys, Kotak Mahindra Bank, Eternal, UltraTech Cement, Bajaj Finance, IRFC, Nestle India, Paytm, others to post earnings; check list - Upstox",Upstox,0.0,Neutral
2025-07-20,HDFC & ICICI Bank report strong earnings with record profits in Q1 - The Times of India,The Times of India,0.7351,Positive
2025-07-20,"Stocks to Watch on Monday, July 21: Reliance Industries, BEML, HDFC Bank, JSW Steel, Hindustan Zinc and more - The Indian Express",The Indian Express,0.0,Neutral
2025-07-21,"Sensex soars over 400 pts, Nifty above 25,000: Buying in ICICI, HDFC Bank among key factors behind market... - Moneycontrol.com",Moneycontrol.com,0.4019,Positive
2025-07-21,HDFC Bank Q1FY26 Results: Net Profit Falls 13.68% QoQ Amid High Provisions - Samco,Samco,0.4404,Positive
2025-07-21,"Icici Bank, HDFC Gap Higher After Banks' Earnings Beat Expectations - Investor's Business Daily",Investor's Business Daily,0.0,Neutral
2025-07-21,"HDFC Bank share price targets by CLSA, Goldman Sachs, Jefferies & Nomura - Business Today",Business Today,0.296,Positive
2025-07-21,HDFC Bank vs ICICI Bank: Which stock to buy post Q1 results 2025? - Mint,Mint,0.0,Neutral
2025-07-21,"Beyond 1:1 bonus issue, why HDFC Bank shares remain top pick after Q1 results - The Economic Times",The Economic Times,0.7579,Positive
2025-07-21,"Live: HDFC Bank, ICICI Bank strong Q1 fuel Nifty above 25,000 | Closing Bell - Moneycontrol.com",Moneycontrol.com,0.7184,Positive
2025-07-21,HDFC Bank Seeks Shareholder Approval to Double Authorized Capital and Issue 1:1 Bonus Shares - scanx.trade,scanx.trade,0.8316,Positive
2025-07-21,HDFC Bank stock climbs over 2% post earnings announcement - BusinessLine,BusinessLine,0.0,Neutral
2025-07-21,"Banking stocks trade mixed following Q1 show; ICICI, HDFC Bank gain, Bandhan, RBL Bank drag - Moneycontrol.com",Moneycontrol.com,0.3612,Positive
2025-07-21,"Stock markets rebound on buying in HDFC Bank, ICICI Bank; Sensex climbs 442.61 points - The Hindu",The Hindu,0.0,Neutral
2025-07-21,HDFC Bank vs ICICI Bank vs Axis Bank: Which Banking Giant Emerges Winner in Q1? - outlookbusiness.com,outlookbusiness.com,0.5859,Positive
2025-07-21,HDFC Bank margin drops: Should you Buy or Sell after first ever bonus? - The Financial Express,The Financial Express,0.5423,Positive
2025-07-21,"HDFC Bank share price targets by CLSA, Goldman Sachs, Jefferies & Nomura - MSN",MSN,0.296,Positive
2025-07-21,HDFC Bank: Shares gain nearly 2% after 12% Q1 profit rise; brokerages raise targets - Zee Business,Zee Business,0.8176,Positive
2025-07-21,"HDFC, ICICI Bank results signal patchy credit revival despite rate cuts - Mint",Mint,0.5405,Positive
2025-07-21,Buy HDFC Bank; target of Rs 2300: Motilal Oswal - Moneycontrol.com,Moneycontrol.com,0.0,Neutral
2025-07-21,HDFC Bank shares gain 2% on 12% YoY profit jump. Is it time to buy? - The Economic Times,The Economic Times,0.8176,Positive
2025-07-21,"Stock Picks Today: HDFC Bank, ICICI Bank, RIL, JSW Steel, Bandhan Bank On Brokerage Radar - NDTV Profit",NDTV Profit,0.4404,Positive
2025-07-21,"ICICI Delivers Growth, HDFC Bank Stands Cautious in Q1, but Both Stocks Rise 2% - outlookbusiness.com",outlookbusiness.com,0.1531,Positive
2025-07-21,"Stocks in news: UltraTech, Eternal, RIL, ICICI Bank, HDFC Bank, Jio Financial - The Economic Times",The Economic Times,0.0,Neutral
2025-07-21,"HDFC Bank Reclaims Rs 2,000, ADR Hits New High; Why BUY This Bank Stock Before 1:1 Bonus, Rs 5 Dividend? - Goodreturns",Goodreturns,0.5423,Positive
2025-07-21,"HDFC Bank Share Price: Stock surges post Q1 results, bonus and dividend announcement - Do you own? - India TV News",India TV News,0.6908,Positive
2025-07-21,"Strong Q1, growth hopes drive gains for HDFC Bank and ICICI Bank - Business Standard",Business Standard,0.8779,Positive
2025-07-21,HDFC Bank first-ever 1:1 bonus issue: Bank announces Rs 5 special dividend; here’s what it means for inve - The Times of India,The Times of India,0.7351,Positive
2025-07-21,"Stock to Watch today, July 21: Reliance, HDFC Bank, ICICI Bank, Dr. Reddy's - Business Standard",Business Standard,0.0,Neutral
2025-07-21,"Muted Monday: Nifty below 25,000, HDFC Bank up 2%; Anthem Biosciences lists at 27% premium - The Financial Express",The Financial Express,0.4019,Positive
2025-07-21,"HDFC Bank stock price target raised to INR2,300 by CLSA on strong results - Investing.com",Investing.com,0.5106,Positive
2025-07-21,"Stocks to Watch Today: RIL, HDFC Bank, ICICI Bank, JSW Steel, IDFC First Bank, Dr Reddys Labs, IRCON, Sona... - Moneycontrol.com",Moneycontrol.com,0.0,Neutral
2025-07-21,Bank stocks rally on Q1 results; HDFC announces 1:1 bonus issue - BusinessLine,BusinessLine,0.5423,Positive
2025-07-21,"Not HDFC or YES Bank: These 3 bank stocks can rally up to 16%, say charts - Business Standard",Business Standard,-0.4215,Negative
2025-07-21,ICICI Bank vs HDFC Bank: Which bank stock should you choose after their Q1 results? - Trade Brains,Trade Brains,0.0,Neutral
2025-07-21,"From Reliance, HDFC Bank to Yes Bank, 10 stocks to watch today - The Financial Express",The Financial Express,0.4019,Positive
2025-07-21,"HDFC Bank shares gain as profit grows 12%, but NIMs slip; should you buy, sell, or hold? - Moneycontrol.com",Moneycontrol.com,0.5789,Positive
2025-07-21,"HDFC Bank bonus shares, Q1 results: Strong provisions prompt ‘Buy’ call from stock analysts - Business Today",Business Today,0.8402,Positive
2025-07-21,"HDFC Bank share price rises 2% post Q1 results, dividend, and bonus announcement: Buy or sell? - Mint",Mint,0.6908,Positive
2025-07-21,"HDFC Bank shares gain in response to Q1 results, no analyst has a 'sell' call - CNBC TV18",CNBC TV18,0.5267,Positive
2025-07-21,HDFC Bank Vs ICICI Bank: Which Stock Deserves A Spot In Your Portfolio Post Q1FY26? - News18,News18,0.0,Neutral
2025-07-21,"HDFC Bank vs ICICI Bank: Which private lender performed better in Q1FY26? Check revenue, net profit and other details - Upstox",Upstox,0.7003,Positive
2025-07-21,"Sensex jumps 400 pts, Nifty above 25,000; ICICI Bank, HDFC Bank lead gains - Business Standard",Business Standard,0.6249,Positive
2025-07-21,"CLSA’s top banking sector picks: ICICI Bank, SBI and more - The Financial Express",The Financial Express,0.2023,Positive
2025-07-21,"Q1 results 2025: Infosys, Paytm, Nestle India, Eternal among companies to declare earnings this week; check full list - Mint",Mint,0.0,Neutral
2025-07-21,"HDFC Bank, ICICI Bank lead India's stock benchmarks higher, Reliance caps gains - Reuters",Reuters,0.34,Positive
2025-07-22,HDFC Bank shares jump 3% in 2 days after Q1 results. 5 reasons behind the move - The Economic Times,The Economic Times,0.296,Positive
2025-07-22,"HDFC Bank Q1 Results Impress, But Will Bonus Share Issue Boost Stock? - Analytics Insight",Analytics Insight,0.9194,Positive
2025-07-22,"Stock markets rebound on buying in HDFC Bank, ICICI Bank - The Hans India",The Hans India,0.0,Neutral
2025-07-22,'Reaping the rewards': Why short-term investors leaning towards ICICI Bank over HDFC Bank? Key reasons ex - The Times of India,The Times of India,0.4767,Positive
2025-07-22,"Stocks making the biggest moves mid-day: Eternal, Swiggy, Paytm, HDFC Bank and more - The Financial Express",The Financial Express,0.0,Neutral
2025-07-22,HDFC Bank and ICICI Bank rallied on strong results. What do the charts say happens next? - The Financial Express,The Financial Express,0.5106,Positive
2025-07-23,"Taking Stock: Nifty above 25,200 on buying support, ICICI and HDFC Bank hit record but broader markets... - Moneycontrol.com",Moneycontrol.com,0.4019,Positive
2025-07-23,"HDFC Bank Reaches All-Time High, Signaling Strong Market Confidence and Growth Potential - Markets Mojo",Markets Mojo,0.8555,Positive
2025-07-23,Buy HDFC Bank; target of Rs 2350: ICICI Securities - Moneycontrol.com,Moneycontrol.com,0.296,Positive
2025-07-23,"Market Trading Guide: HDFC Bank, Bharti Airtel among 7 stocks to buy on Thursday. Potential upside of up to 8% seen - The Economic Times",The Economic Times,0.0,Neutral
2025-07-23,HDFC Bank Approaches 52-Week High Amid Positive Market Sentiment and Strong Performance - Markets Mojo,Markets Mojo,0.7845,Positive
2025-07-23,"Stock Market Highlights: Nifty, Sensex End Higher As HDFC Bank Leads Gains - NDTV Profit",NDTV Profit,0.7906,Positive
2025-07-24,"Stock Market Highlights: Nifty, Sensex Tank As RIL, Infosys, HDFC Bank Drag - NDTV Profit",NDTV Profit,0.5719,Positive
2025-07-24,"HDFC Bank Achieves All-Time High, Signaling Strong Market Position Amid Volatility - Markets Mojo",Markets Mojo,0.5106,Positive
2025-07-24,"NSDL IPO: Dates announced for Rs 4,000 crore issue, NSE to sell 1.8 crore shares - The Economic Times",The Economic Times,0.296,Positive
2025-07-24,"Ex-date alert! HDFC Bank, LIC, 52 others to trade ex-dividend on July 25 - Business Standard",Business Standard,0.3595,Positive
2025-07-24,Why Warren Buffett would disapprove HDFC Bank’s bonus issue - Value Research,Value Research,0.7096,Positive
2025-07-24,"NSE, banks to offload 5 cr NSDL shares in IPO - The Times of India",The Times of India,0.296,Positive
2025-07-24,"NSDL IPO to open on July 30; NSE, HDFC Bank, SBI, IDBI Bank, others to offload shares in OFS - Mint",Mint,0.296,Positive
2025-07-25,"NSDL IPO: NSE, IDBI Bank-Backed Issue's Price Band Fixed At Rs 760-800 Per Share—Check Issue Size, Key Dates - NDTV Profit",NDTV Profit,0.4404,Positive
2025-07-25,"Who's selling in the NSDL IPO? HDFC, SBI, NSE, others eye windfall from OFS - Business Standard",Business Standard,0.0,Neutral
2025-07-25,Does HDFC Bank's 1:1 Bonus Issue Pass Warren Buffett's Checklist? A Lesson From Berkshire’s Class A shares - Goodreturns,Goodreturns,0.6908,Positive
2025-07-25,"HDFC Bank unlocks massive gains ahead of NSDL IPO, fuels retail frenzy in unlisted market - Mint",Mint,0.0258,Neutral
2025-07-25,ICICI vs HDFC vs Axis Bank: Which bank stock is best for your portfolio? - Business Standard,Business Standard,0.6369,Positive
2025-07-25,NSDL IPO date out: 5 Key differences between NSDL and CDSL every investor should know - The Financial Express,The Financial Express,0.0,Neutral
2025-07-25,"HDB Financial down 3% today, nears IPO price; why is the stock falling? - Business Standard",Business Standard,-0.1531,Negative
2025-07-25,"NSDL to launch ₹4,012 cr OFS-only IPO on July 30; IDBI Bank, NSE, SBI, HDFC Bank, UBI to trim stakes - Fortune India",Fortune India,0.0,Neutral
2025-07-26,"IDFC First Bank Q1 earnings preview: Asset quality to remain stable on deposit growth, improved margins - Mint",Mint,0.8555,Positive
2025-07-26,HDFC Bank vs. Kotak vs. Axis: A head-to-head battle of the Q1 bank results - The Financial Express,The Financial Express,-0.3818,Negative
2025-07-28,"NSDL IPO turns early bets into goldmine for SBI, NSE, HDFC Bank - Moneycontrol.com",Moneycontrol.com,0.0,Neutral
2025-07-28,"Rs 135 NSDL IPO GMP: NSE, SBI, HDFC Bank and others are selling shares; subscription starts on July 30 - ET Now",ET Now,0.296,Positive
2025-07-29,"Indian benchmarks snap 3-day losing run as Reliance, HDFC Bank gain - Reuters",Reuters,0.2023,Positive
2025-07-29,HDFC Bank Executes Significant Block Trade Worth Rs. 103.10 Crore on NSE - scanx.trade,scanx.trade,-0.0516,Negative
2025-07-29,"Sensex Nifty Today, Stock Market highlights: Markets rebound after 3-day decline; Sensex jumps 447 points - BusinessLine",BusinessLine,0.4019,Positive
2025-07-29,SEBI Imposes Rs 10 lakh penalty in insider trading case involving HDFC Limited and HDFC Bank - Moneycontrol.com,Moneycontrol.com,-0.6486,Negative
2025-07-29,"NSE Q1 Results: IPO-bound firm posts 14% YoY rise in profit to ₹2,924 crore, even as revenue dips 11% - Mint",Mint,0.4404,Positive
2025-07-30,"NSDL's IPO - Institutional shareholders to get 39,900% return: SBI invested in the depository at ₹2 per sha... - Bhaskar English",Bhaskar English,0.0,Neutral
2025-07-30,NSDL IPO: Existing shareholders from NSE to IDBI Bank gain up to 400x on their investment - CNBC TV18,CNBC TV18,0.5267,Positive
2025-07-30,4 Stocks Declaring Bonus Shares and Stock Splits in August 2025 - Equitymaster,Equitymaster,0.6908,Positive
2025-07-30,HUF Penalised Rs10 Lakh for Insider Trading during Merger of HDFC with HDFC Bank - Moneylife,Moneylife,0.0,Neutral
